{
  "document_id": "BNS_2023",
  "title": "Bharatiya Nyaya Sanhita, 2023",
  "source_name": "India Code",
  "source_url": "https://indiacode.gov.in/handle/123456789/496548",
  "source_domain": "indiacode.nic.in",
  "source_type": "PRIMARY_LEGAL_SOURCE",
  "authority_tier": 1,
  "authority_score": 1.0,
  "jurisdiction": "India",
  "document_type": "ACT",
  "act_name": "Bharatiya Nyaya Sanhita, 2023",
  "section_number": null,
  "chapter": null,
  "judgment_date": null,
  "publication_date": "2023-12-25",
  "retrieval_date": "2026-08-26T10:38:13Z",
  "language": "en",
  "file_format": "pdf",
  "original_file_name": "Bharatiya_Nyaya_Sanhita_2023.pdf",
  "content_hash": "d4449e9995b21fd52627811d08f9d21feda6a3678b7e5355b651242d152167f5",
  "processing_status": "RAW_INGESTED"
}
